Issue_key,Summary,keyword
HBASE-26866,Shutdown WAL may abort region server,"['replica', 'region', 'region', 'region', 'region', 'region', 'region', 'region', 'region', 'region', 'race', 'race', 'race', 'race', 'server', 'server', 'server', 'server', 'server', 'server', 'server', 'server', 'server', 'server']"
HBASE-27061,two phase bulkload is broken when SFT is in use.,"['region', 'region', 'region', 'region', 'region', 'region', 'region', 'region', 'region', 'server', 'server', 'server', 'server', 'server', 'server', 'server']"
HBASE-24961,[HBOSS] HBaseObjectStoreSemantics.close should call super.close to make sure its own instance always get removed from FileSystem.CACHE,"['region', 'region', 'region', 'region', 'region', 'server', 'server', 'server', 'server', 'server']"
HBASE-25902,Add missing CFs in meta during HBase 1 to 2.3+ Upgrade,"['cluster', 'meta', 'meta', 'meta', 'meta', 'meta', 'meta', 'meta', 'meta']"
HBASE-27564,Add default encryption type for MiniKDC to fix failed tests on JDK11+,"['node', 'node', 'node', 'node', 'node', 'node', 'connection', 'connection']"
HBASE-27193,TestZooKeeper is flaky,"['node', 'race', 'race', 'race', 'race', 'race', 'race', 'race', 'race', 'race', 'race', 'race', 'race', 'race', 'server', 'server']"
HBASE-25877,Add access  check for compactionSwitch,"['region', 'server']"
HBASE-27094,Encryption data contains checksum,"['block', 'block', 'block', 'block', 'block']"
HBASE-22649,Encode StoreFile path URLs in the UI to handle scenarios where CF contains special characters (like # etc.),"['node', 'node', 'node', 'node', 'node', 'node', 'node', 'node', 'node', 'node', 'server', 'server', 'server', 'server', 'server']"
HBASE-25827,Per Cell TTL tags get duplicated with increments causing tags length overflow,"['block', 'corrupt', 'corrupt', 'corrupt', 'region', 'region', 'region', 'region', 'region', 'region', 'region', 'region', 'region', 'region', 'region', 'region', 'region', 'region', 'region', 'region', 'region', 'region', 'region', 'region', 'region', 'region', 'region', 'region', 'region', 'region', 'server', 'server', 'server', 'server', 'server', 'server', 'server', 'server', 'server', 'server', 'server', 'server', 'server', 'server', 'server', 'server', 'server', 'server', 'server', 'server', 'server', 'server', 'server', 'server', 'server', 'server']"
HBASE-22922,Only the two first regions are locked in MergeTableRegionsProcedure,"['region', 'region', 'region']"
HBASE-22441,BucketCache NullPointerException in cacheBlock,"['cluster', 'region', 'region', 'region', 'region', 'region', 'region', 'region', 'region', 'region', 'server', 'server', 'server', 'server', 'server', 'server', 'server', 'server', 'server']"
HBASE-25470,Add unitest for HBASE-25445 - SplitWALRemoteProcedure failed to archive split WAL,"['assign', 'region', 'region', 'assign']"
HBASE-23149,hbase shouldPerformMajorCompaction logic is not correct,"['block', 'block', 'block', 'block', 'block', 'block', 'region', 'region', 'region', 'region', 'region', 'region', 'region', 'region', 'region', 'region', 'region', 'region', 'region', 'region', 'server', 'server', 'server', 'server', 'server', 'server', 'server', 'server', 'server']"
HBASE-23294,ReplicationBarrierCleaner should delete all the barriers for a removed region which does not belong to any serial replication peer,"['replica', 'region']"
HBASE-24656,[Flakey Tests] branch-2 TestMasterNoCluster.testStopDuringStart,['race']
HBASE-22937,The RawBytesComparator in branch-1 have wrong comparison order,['corrupt']
HBASE-22191,2.1.4 is busted?,"['cluster', 'region', 'region', 'race', 'race', 'server', 'server']"
HBASE-24956,ConnectionManager#locateRegionInMeta waits for user region lock indefinitely.,"['connection', 'meta', 'region']"
HBASE-27336,The region visualizer shows 'undefined' region server,"['region', 'region', 'server']"
HBASE-22287,inifinite retries on failed server in RSProcedureDispatcher,"['cluster', 'server', 'server', 'server', 'server']"
HBASE-24506,async client deadlock,"['cluster', 'region', 'server', 'server', 'server', 'server', 'restart']"
HBASE-24189,WALSplit recreates region dirs for deleted table with recovered edits data,"['consistent', 'crash', 'region', 'region', 'region', 'region', 'region', 'server', 'server', 'server', 'restart']"
HBASE-24399,[Flakey Tests] Some UTs about RSGroup should wait RSGroupInfoManager to be online,"['server', 'server']"
HBASE-23005,Table UI showed exception message when table is disabled,"['server', 'server', 'server', 'server', 'server', 'server', 'server', 'server', 'server', 'server', 'server']"
HBASE-26311,Balancer gets stuck in cohosted replica distribution,"['replica', 'replica']"
HBASE-27561,hbase.master.port is ignored in processing of hbase.masters ,['server']
HBASE-22929,MemStoreLAB  ChunkCreator may memory leak,"['crash', 'region', 'region', 'region', 'region', 'server']"
HBASE-27160,ClientZKSyncer.deleteDataForClientZkUntilSuccess should break from the loop when deletion is succeeded,"['node', 'meta', 'meta', 'region', 'region', 'server', 'server', 'server']"
HBASE-23561,Look up of Region in Master by encoded region name is O(n),"['node', 'node', 'node', 'region', 'region']"
HBASE-27147,[HBCK2] extraRegionsInMeta does not work If RegionInfo is null,"['meta', 'meta', 'region', 'region', 'server']"
HBASE-25848,Add flexibility to backup replication in case replication filter throws an exception,"['replica', 'replica', 'replica', 'region', 'server']"
HBASE-26742,Comparator of NOT_EQUAL NULL is invalid for checkAndMutate,['server']
HBASE-22941,MetaTableAccessor.getMergeRegions() returns parent regions in random order,"['region', 'region', 'region', 'region', 'region', 'region']"
HBASE-26875,RpcRetryingCallerImpl translateException ignores return value of recursive call,['block']
HBASE-25611,ExportSnapshot chmod flag uses value as decimal,['cluster']
HBASE-25901,Replication may lose data during regionserver restart when multiwal is in use,"['replica', 'region', 'region', 'server', 'server', 'restart', 'restart']"
HBASE-23659,BaseLoadBalancer#wouldLowerAvailability should consider region replicas,"['replica', 'replica', 'replica', 'assign', 'assign', 'assign', 'assign', 'region', 'region', 'region', 'region', 'region', 'region', 'region', 'assign', 'assign', 'assign', 'assign', 'server', 'server', 'server']"
HBASE-24885,STUCK RIT by hbck2 assigns,"['assign', 'assign', 'assign', 'assign', 'assign', 'assign', 'assign', 'region', 'region', 'region', 'region', 'region', 'region', 'region', 'region', 'region', 'region', 'assign', 'assign', 'assign', 'assign', 'assign', 'assign', 'assign', 'server']"
HBASE-22006,Fix branch-2.1 findbugs warning; causes nightly show as failed.,"['region', 'region', 'region', 'server', 'server', 'server']"
HBASE-26281,DBB got from BucketCache would be freed unexpectedly before RPC completed,"['delay', 'block', 'block', 'block', 'block', 'block', 'block', 'block', 'block', 'block']"
HBASE-23150,TestBulkLoadReplication is broken,"['region', 'region', 'region', 'region', 'race', 'server', 'server', 'server', 'server']"
HBASE-26075,Replication is stuck due to zero length wal file in oldWALs directory.,"['node', 'node', 'node', 'node', 'node', 'cluster', 'cluster', 'cluster', 'cluster', 'cluster', 'replica', 'replica', 'replica', 'replica', 'replica', 'replica', 'replica', 'replica', 'replica', 'replica', 'replica', 'block', 'block', 'block', 'block', 'block', 'region', 'region', 'region', 'region', 'region', 'region', 'region', 'region', 'region', 'region', 'region', 'region', 'region', 'region', 'region', 'region', 'region', 'region', 'region', 'race', 'race', 'server', 'server', 'server', 'server', 'server', 'server', 'server', 'server', 'server', 'server', 'server', 'server', 'server', 'server', 'server', 'server', 'server', 'server', 'server']"
HBASE-25583,Handle the NoNode exception in remove log replication and avoid RS crash,"['node', 'node', 'node', 'node', 'node', 'node', 'replica', 'replica', 'replica', 'replica', 'replica', 'replica', 'replica', 'replica', 'replica', 'crash', 'crash', 'crash', 'region', 'region', 'region', 'region', 'region', 'region', 'region', 'region', 'region', 'region', 'region', 'region', 'region', 'region', 'server', 'server', 'server', 'server', 'server', 'server', 'server', 'server', 'server', 'server', 'server', 'server', 'server', 'server']"
HBASE-25829,SPLIT state detritus,"['assign', 'assign', 'assign', 'assign', 'assign', 'assign', 'assign', 'assign', 'region', 'region', 'region', 'region', 'region', 'region', 'region', 'region', 'region', 'region', 'region', 'region', 'region', 'region', 'region', 'region', 'region', 'region', 'region', 'region', 'assign', 'assign', 'assign', 'assign', 'assign', 'assign', 'assign', 'assign', 'server', 'server', 'server', 'server', 'server', 'server', 'server', 'server', 'server', 'server', 'server']"
HBASE-22881,Fix non-daemon threads in hbase server implementation,['server']
HBASE-23741,Data loss when WAL split to HFile enabled,"['region', 'region']"
HBASE-22416,HBOSS: unit tests fail with ConnectionLoss when IPv6 enabled and not set up locally,['block']
HBASE-23192,CatalogJanitor consistencyCheck does not log problematic row on exception,"['crash', 'meta', 'server']"
HBASE-22510,Address findbugs/spotbugs complaints (branch-1) ,"['region', 'region', 'server', 'server', 'server']"
HBASE-24074,ConcurrentModificationException occurred in ReplicationSourceManager while refreshing the peer,"['replica', 'replica', 'replica', 'replica', 'replica', 'region', 'region', 'region', 'region', 'region', 'server', 'server', 'server', 'server', 'server']"
HBASE-23202,ExportSnapshot (import) will fail if copying files to root directory takes longer than cleaner TTL,['cluster']
HBASE-26232,SEEK_NEXT_USING_HINT is ignored on reversed Scans,"['region', 'region', 'server', 'server', 'server', 'server']"
HBASE-23181,"Blocked WAL archive: ""LogRoller: Failed to schedule flush of XXXX, because it is not online on us""","['cluster', 'assign', 'block', 'meta', 'region', 'region', 'region', 'region', 'region', 'region', 'region', 'region', 'region', 'region', 'region', 'assign', 'server', 'server', 'server', 'server', 'server', 'server', 'server', 'restart']"
HBASE-22206,dist.apache.org must not be used for public downloads,['server']
HBASE-25077,"hbck.jsp page loading fails, logs NPE in master log.","['region', 'region', 'server']"
HBASE-27485,HBaseTestingUtility minicluster requires log4j2,['cluster']
HBASE-27600,Make the behavior of hadoop profile consistent,['consistent']
HBASE-27547,Close store file readers after region warmup ,"['cluster', 'region', 'region', 'region', 'region']"
HBASE-24342,[Flakey Tests] Disable TestClusterPortAssignment.testClusterPortAssignment as it can't pass 100% of the time,"['region', 'region', 'server', 'server', 'server', 'server']"
HBASE-24376,MergeNormalizer is merging non-adjacent regions and causing region overlaps/holes.,"['cluster', 'region', 'region', 'region', 'region', 'region', 'region', 'region', 'region', 'region']"
HBASE-26790,getAllRegionLocations can cache locations with null hostname,"['meta', 'meta', 'region', 'region', 'server', 'server', 'server']"
HBASE-26786,[hboss] Limit synchronization from hot path of HBoss APIs,"['block', 'parallel', 'region']"
HBASE-27621,Also clear the Dictionary when resetting when reading compressed WAL file,"['replica', 'replica', 'corrupt']"
HBASE-22860,Master's webui returns NPE/HTTP 500 under maintenance mode,"['server', 'server', 'server', 'server', 'server', 'server', 'server', 'server', 'server', 'server', 'server']"
HBASE-24588,Normalizer plan execution is not consistent between plan types,"['consistent', 'consistent', 'block', 'block']"
HBASE-26674,Should modify filesCompacting under storeWriteLock,"['region', 'region', 'region', 'region', 'region', 'region', 'race', 'server', 'server', 'server', 'server', 'server', 'server', 'server', 'server']"
HBASE-25651,NORMALIZER_TARGET_REGION_SIZE needs a unit in its name,['region']
HBASE-25850,Fix spotbugs warnings on branch-2,['server']
HBASE-25499,False-positive findbugs issue on branch-2.2,['block']
HBASE-23328,info:regioninfo goes wrong when region replicas enabled,"['cluster', 'replica', 'replica', 'replica', 'replica', 'meta', 'meta', 'meta', 'region', 'region', 'region', 'region', 'region', 'region', 'region', 'region']"
HBASE-26767,Rest server should not use a large Header Cache.,['server']
HBASE-27017,MOB snapshot is broken when FileBased SFT is used,"['region', 'region', 'region', 'server']"
HBASE-26204,VerifyReplication should obtain token for peerQuorumAddress too,"['cluster', 'cluster', 'cluster', 'cluster', 'region', 'region', 'server', 'server']"
HBASE-26155,JVM crash when scan,"['cluster', 'block', 'block', 'block', 'block', 'block', 'block', 'block', 'block', 'block', 'block', 'block', 'block', 'block', 'crash', 'region', 'region', 'region', 'server', 'server', 'server']"
HBASE-26350,Missing server side debugging on failed SASL handshake,['server']
HBASE-23744,FastPathBalancedQueueRpcExecutor should enforce queue length of 0,"['cluster', 'block', 'server']"
HBASE-26480,Close NamedQueueRecorder to allow HMaster/RS to shutdown gracefully,"['cluster', 'race', 'race', 'server', 'server']"
HBASE-26977,"HMaster's ShutdownHook does not take effect, if tablesOnMaster is false","['block', 'block']"
HBASE-27379,numOpenConnections metric is one less than the actual ,"['server', 'server', 'server', 'server', 'server', 'server', 'server', 'server', 'server', 'server', 'server', 'server', 'server']"
HBASE-25130,[branch-1] Masters in-memory serverHoldings map is not cleared during hbck repair,"['assign', 'meta', 'region', 'region', 'region', 'region', 'region', 'region', 'assign', 'server', 'server', 'server', 'server', 'server']"
HBASE-25216,The client zk syncer should deal with meta replica count change,"['node', 'replica', 'replica', 'replica', 'meta', 'meta', 'meta', 'meta', 'meta', 'region', 'restart']"
HBASE-24529,hbase.rs.evictblocksonclose is not honored when removing compacted files and closing the storefiles,"['block', 'block', 'block', 'region', 'region', 'server', 'server', 'server', 'server']"
HBASE-22767,System table RIT STUCK if their RSGroup has no highest version RSes,"['assign', 'assign', 'assign', 'meta', 'meta', 'region', 'region', 'region', 'region', 'assign', 'assign', 'assign', 'server', 'server', 'server', 'server', 'server', 'server', 'server', 'server', 'server', 'server', 'restart']"
HBASE-23313,[hbck2] setRegionState should update Master in-memory state too,"['meta', 'meta']"
HBASE-23594,Procedure stuck due to region happen to recorded on two servers.,"['remote', 'assign', 'assign', 'assign', 'assign', 'assign', 'assign', 'assign', 'assign', 'assign', 'assign', 'assign', 'assign', 'assign', 'assign', 'assign', 'assign', 'assign', 'assign', 'assign', 'assign', 'assign', 'assign', 'assign', 'assign', 'block', 'meta', 'meta', 'meta', 'meta', 'meta', 'meta', 'parallel', 'region', 'region', 'region', 'region', 'region', 'region', 'region', 'region', 'region', 'region', 'region', 'region', 'region', 'region', 'region', 'region', 'region', 'region', 'region', 'region', 'region', 'region', 'region', 'region', 'region', 'region', 'region', 'region', 'region', 'region', 'region', 'region', 'region', 'region', 'region', 'region', 'region', 'region', 'region', 'region', 'region', 'region', 'region', 'region', 'region', 'region', 'region', 'region', 'region', 'region', 'region', 'region', 'region', 'region', 'region', 'region', 'region', 'region', 'region', 'region', 'region', 'region', 'region', 'region', 'assign', 'assign', 'assign', 'assign', 'assign', 'assign', 'assign', 'assign', 'assign', 'assign', 'assign', 'assign', 'assign', 'assign', 'assign', 'assign', 'assign', 'assign', 'assign', 'assign', 'assign', 'assign', 'assign', 'assign', 'server', 'server', 'server', 'server', 'server', 'server', 'server', 'server', 'server', 'server', 'server', 'server', 'server', 'server', 'server', 'server', 'server', 'server', 'server']"
HBASE-27230,RegionServer should be aborted when WAL.sync throws TimeoutIOException,"['region', 'region', 'region', 'region', 'region', 'server', 'server']"
HBASE-22207,Fix flakey TestAssignmentManager.testAssignSocketTimeout,"['assign', 'meta', 'meta', 'assign']"
HBASE-25817,Memory leak from thrift server hashMap,['server']
HBASE-25897,TestRetainAssignmentOnRestart is flaky after HBASE-25032,"['assign', 'assign', 'region', 'region', 'region', 'region', 'region', 'region', 'assign', 'assign', 'server', 'server', 'restart']"
HBASE-26715,Blocked on SyncFuture in AsyncProtobufLogWriter#write,"['block', 'block', 'region', 'region', 'region', 'region', 'region', 'region', 'region', 'region', 'region', 'race', 'server', 'server', 'server', 'server', 'server', 'server', 'server', 'server', 'server']"
HBASE-25311,ui throws NPE,"['node', 'server', 'restart', 'restart']"
HBASE-24802,make a drop-in compatible impl of htrace APIs that does not do anything,"['block', 'race', 'race']"
HBASE-26615,Snapshot referenced data files are deleted when delete a table with merge regions,"['cluster', 'meta', 'region', 'region', 'region', 'region']"
HBASE-24239,[HBCK2] Remove removeExtraRegionsFromMeta from HBCK2 doc,"['meta', 'region', 'region']"
HBASE-24545,Add backoff to SCP check on WAL split completion,"['cluster', 'recovery', 'server']"
HBASE-24247,Failed multi-merge because two regions not adjacent (legitimately).,"['assign', 'assign', 'assign', 'region', 'region', 'region', 'assign', 'assign', 'assign']"
HBASE-22551,TestMasterOperationsForRegionReplicas is flakey,"['region', 'server']"
HBASE-27362,Fix some tests hung by CompactSplit.requestCompactionInternal ignoring compactionsEnabled check,['region']
HBASE-26675,Data race on Compactor.writer,"['assign', 'race', 'race', 'assign']"
HBASE-27055,Add additional comments when using HBASE_TRACE_OPTS with standalone mode,['race']
HBASE-26433,Rollback from ZK-less to ZK-based assignment could produce inconsistent state - doubly assigned regions,"['cluster', 'consistent', 'consistent', 'consistent', 'assign', 'assign', 'assign', 'assign', 'assign', 'assign', 'assign', 'assign', 'assign', 'meta', 'meta', 'meta', 'region', 'region', 'region', 'region', 'region', 'region', 'region', 'region', 'region', 'region', 'region', 'region', 'region', 'region', 'assign', 'assign', 'assign', 'assign', 'assign', 'assign', 'assign', 'assign', 'assign', 'server', 'server', 'server', 'server', 'server', 'restart', 'restart']"
HBASE-26087,JVM crash when displaying RPC params by MonitoredRPCHandler,['crash']
HBASE-25230,Embedded zookeeper server not clean up the old data,"['cluster', 'server', 'server']"
HBASE-22343,Make procedure retry interval configurable in test,"['assign', 'region', 'assign']"
HBASE-26406,Can not add peer replicating to non-HBase,"['cluster', 'cluster', 'cluster', 'replica', 'replica', 'replica', 'replica', 'replica', 'replica', 'replica', 'replica', 'replica', 'replica', 'replica', 'replica', 'race', 'race']"
HBASE-22408,add a metric for regions OPEN on non-live servers,"['delay', 'assign', 'corrupt', 'region', 'region', 'region', 'region', 'assign', 'server', 'server', 'server']"
HBASE-26026,HBase Write may be stuck forever when using CompactingMemStore,['cluster']
HBASE-24995,MetaFixer fails to fix overlaps when multiple tables have overlaps,['region']
HBASE-25828,"CompactionProgress WARNS: ""totalCompactingKVs=N less than currentCompactedKVs=M""","['block', 'region', 'region', 'region', 'server', 'server', 'server']"
HBASE-24571,HBCK2 fix addFsRegionsMissingInMeta to add regions in CLOSED state again,"['assign', 'assign', 'meta', 'region', 'region', 'region', 'region', 'region', 'region', 'region', 'region', 'region', 'assign', 'assign']"
HBASE-26811,Secondary replica may be disabled for read incorrectly forever,"['replica', 'replica', 'replica', 'replica', 'replica', 'replica', 'replica', 'replica', 'replica', 'replica', 'replica', 'replica', 'replica', 'replica', 'replica', 'replica', 'replica', 'replica', 'replica', 'replica', 'replica', 'block', 'region', 'region', 'region', 'region', 'region', 'region', 'region', 'region', 'region', 'region', 'region', 'region', 'region', 'region', 'region', 'region', 'region', 'region', 'region', 'region', 'region', 'region', 'region', 'region', 'region', 'server', 'server', 'server', 'server']"
HBASE-26029,It is not reliable to use nodeDeleted event to track region server's death,"['node', 'node', 'replica', 'replica', 'replica', 'region', 'region', 'region', 'region', 'region', 'region', 'region', 'region', 'server', 'server', 'server', 'server', 'server', 'server', 'server', 'server']"
HBASE-23282,HBCKServerCrashProcedure for 'Unknown Servers',"['cluster', 'assign', 'assign', 'assign', 'assign', 'crash', 'meta', 'meta', 'meta', 'region', 'assign', 'assign', 'assign', 'assign', 'server', 'server', 'server', 'server', 'server', 'server', 'restart']"
HBASE-27335,HBase shell hang for a minute when quiting,"['cluster', 'meta']"
HBASE-24190,Make kerberos value of hbase.security.authentication property case insensitive,"['network', 'consistent', 'distributed']"
HBASE-22980,HRegionPartioner getPartition() method incorrectly partitions the regions of the table.,"['region', 'region', 'region', 'region', 'region', 'region', 'region', 'region', 'region', 'region', 'region', 'region', 'region', 'region', 'region', 'region', 'partition', 'partition', 'partition', 'partition']"
HBASE-23695,Fail more gracefully when test class is missing Category,['race']
HBASE-27628,Spotless fix in RELEASENOTES.md,"['cluster', 'cluster', 'cluster', 'replica', 'replica', 'replica', 'replica', 'region', 'region', 'server', 'server']"
HBASE-25594,graceful_stop.sh fails to unload regions when ran at localhost,"['cluster', 'remote', 'region', 'region', 'region', 'region', 'region', 'race', 'race', 'race', 'race', 'race', 'race', 'race', 'server', 'server', 'restart', 'restart', 'restart']"
HBASE-25287,Forgetting to unbuffer streams results in many CLOSE_WAIT sockets when loading files,"['cluster', 'cluster', 'block', 'region']"
HBASE-24794,hbase.rowlock.wait.duration should not be <= 0,"['cluster', 'meta', 'meta', 'region', 'region', 'region', 'region', 'region', 'region', 'region', 'region', 'region', 'region', 'region', 'region', 'server', 'server', 'server', 'server', 'server', 'server', 'server', 'server', 'server', 'server', 'server']"
HBASE-25922,Disabled sanity checks ignored on snapshot restore,"['crash', 'region', 'server', 'restart']"
HBASE-27528,log duplication issues in MasterRpcServices,"['remote', 'remote', 'remote', 'remote', 'race', 'race', 'race', 'race', 'server', 'server']"
HBASE-24844,Exception on standalone (master) shutdown,"['connection', 'region', 'region', 'region', 'race', 'server', 'server', 'server']"
HBASE-26361,Enable OpenTelemetry to be used from developer sandbox,"['race', 'race']"
HBASE-24778,[hbase-operator-tools] Merging regions failed when the table is not default namespace,"['region', 'region', 'region', 'region']"
HBASE-22530,The metrics of store files count of region are returned to clients incorrectly,['region']
HBASE-26142,NullPointerException when set 'hbase.hregion.memstore.mslab.indexchunksize.percent' to zero,"['region', 'region', 'region', 'region', 'region', 'region', 'region', 'region', 'region', 'region', 'region', 'region', 'region', 'region', 'server', 'server', 'server', 'server', 'server', 'server', 'server', 'server', 'server', 'server']"
HBASE-24151,[rsgroup] The master server  aborted for IllegalThreadStateException,"['server', 'server', 'server', 'server']"
HBASE-25060,[HBOSS] TreeLockManager should not define itself as the default implementation for fs.hboss.sync.impl,"['region', 'region', 'region', 'region', 'region', 'region', 'server', 'server', 'server', 'server', 'server']"
HBASE-27119,[HBCK2] Some commands are broken after HBASE-24587,['replica']
HBASE-25280,[meta replicas] ArrayIndexOutOfBoundsException in ZKConnectionRegistry,"['replica', 'replica', 'replica', 'meta', 'race']"
HBASE-24890,The command regioninfo is not available,"['region', 'region']"
HBASE-22426,Disable region split/merge switch doen't work when 'hbase.assignment.usezk' is set true,"['assign', 'assign', 'assign', 'assign', 'region', 'region', 'region', 'assign', 'assign', 'assign', 'assign']"
HBASE-23123,Merge_region fails from shell,['region']
HBASE-27602,Remove the impact of operating env on testHFileCleaning,['region']
HBASE-26114,"when “hbase.mob.compaction.threads.max” is set to a negative number, HMaster cannot start normally ","['region', 'region', 'server', 'server', 'server']"
HBASE-22198,Fix flakey TestAsyncTableGetMultiThreaded,['region']
HBASE-26106,AbstractFSWALProvider#getArchivedLogPath doesn't look for wal file in all oldWALs directory.,"['replica', 'region', 'server', 'server', 'server', 'server', 'server', 'server', 'server']"
HBASE-24377,MemStoreFlusher throw NullPointerException,"['region', 'region', 'region', 'region', 'server', 'server', 'server', 'server']"
HBASE-25599,Backport TestZKSecretWatcher improvement to branch-2.2,['race']
HBASE-23682,Fix NPE when disable DeadServerMetricRegionChore ,"['assign', 'assign', 'region', 'assign', 'assign']"
HBASE-23142,ZooKeeper-Jute missing from HBOSS shaded dependencies with ZK 3.5,"['region', 'region', 'server', 'server']"
HBASE-25562,ReplicationSourceWALReader log and handle exception immediately without retrying,"['replica', 'region', 'server', 'server']"
HBASE-24721,rename_rsgroup overwriting the existing rsgroup.,"['region', 'server', 'server', 'server']"
HBASE-25626,Possible Resource Leak in HeterogeneousRegionCountCostFunction,['server']
HBASE-24752,NPE/500 accessing webui on master startup,['server']
