Issue_key,Summary,keyword
HBASE-22607,TestExportSnapshotNoCluster::testSnapshotWithRefsExportFileSystemState() fails intermittently,['cluster']
HBASE-22074,Should use procedure store to persist the state in reportRegionStateTransition,"['meta', 'region']"
HBASE-22163,Should not archive the compacted store files when region warmup,"['region', 'region', 'region', 'region', 'region', 'region', 'server']"
HBASE-24117,Shutdown AssignmentManager before ProcedureExecutor may cause SCP to accidentally skip assigning a region,"['node', 'remote', 'assign', 'region', 'assign', 'restart']"
HBASE-25255,Master fails to initialize when creating rs group table,"['assign', 'assign', 'assign', 'assign', 'assign', 'assign', 'assign', 'assign', 'assign', 'assign', 'assign', 'assign', 'assign', 'assign']"
HBASE-22784,OldWALs not cleared in a replication slave cluster (cyclic replication bw 2 clusters),"['cluster', 'cluster', 'cluster', 'cluster', 'cluster', 'cluster', 'replica', 'replica', 'replica', 'replica', 'replica', 'replica', 'replica', 'block']"
HBASE-22852,hbase nightlies leaking gpg-agents,['node']
HBASE-22739,ArrayIndexOutOfBoundsException when balance,"['region', 'region', 'region', 'region', 'region', 'region', 'region', 'region', 'region', 'region', 'region', 'region', 'server']"
HBASE-23895,STUCK Region-In-Transition when failed to insert procedure to procedure store,"['node', 'assign', 'assign', 'assign', 'region', 'region', 'region', 'region', 'region', 'region', 'region', 'region', 'region', 'region', 'region', 'region', 'region', 'region', 'region', 'region', 'region', 'region', 'region', 'region', 'region', 'region', 'region', 'region', 'region', 'region', 'region', 'region', 'region', 'region', 'region', 'region', 'region', 'region', 'assign', 'assign', 'assign', 'server', 'server', 'server', 'server', 'server', 'server', 'server', 'server', 'server', 'server', 'server']"
HBASE-25473,"[create-release] checkcompatibility.py failing with ""KeyError: 'binary'""","['block', 'block', 'race']"
HBASE-26768,Avoid unnecessary replication suspending in RegionReplicationSink,"['replica', 'replica', 'replica', 'replica', 'replica', 'replica', 'replica', 'replica', 'replica', 'replica', 'replica', 'block']"
HBASE-25314,branch-1 docker mode for yetus fails,['parallel']
HBASE-23369,Auto-close 'unknown' Regions reported as OPEN on RegionServers,"['cluster', 'cluster', 'assign', 'assign', 'assign', 'assign', 'server', 'server']"
HBASE-26063,The current checkcompatibility.py script can not compare master and rel/2.0.0,"['assign', 'race', 'assign']"
HBASE-22169,Open region failed cause memory leak,"['cluster', 'region', 'region', 'region', 'region', 'region', 'region', 'region', 'region', 'region', 'region', 'region', 'region', 'region', 'region', 'server', 'server', 'server', 'server', 'server', 'server', 'server', 'server', 'server', 'server', 'server', 'server']"
HBASE-26190,High rate logging of BucketAllocatorException: Allocation too big ,['block']
HBASE-22194,Snapshot unittests fail on Windows due to invalid file path uri,['server']
HBASE-22424,Interactions in RSGroup test classes will cause TestRSGroupsAdmin2.testMoveServersAndTables and TestRSGroupsBalance.testGroupBalance flaky  ,['server']
HBASE-22693,snapshot fails with NPE in standalone mode.,['cluster']
HBASE-22298,"branch-2.2 nightly fails ""[ForOverride] Method annotated @ForOverride must have protected or package-private visibility""",['server']
HBASE-25932,TestWALEntryStream#testCleanClosedWALs test is failing.,"['replica', 'race']"
HBASE-27464,In memory compaction 'COMPACT' may cause data corruption when adding cells large than maxAlloc(default 256k) size,['corrupt']
HBASE-22417,DeleteTableProcedure.deleteFromMeta method should remove table from Master's table descriptors cache,['meta']
HBASE-27580,Reverse scan over rows with tags throw exceptions when using DataBlockEncoding,"['connection', 'connection']"
HBASE-22103,HDFS-13209 in Hadoop 3.3.0 breaks asyncwal,"['region', 'region', 'region', 'region', 'region', 'region', 'region', 'region', 'region', 'region', 'server', 'server', 'server', 'server', 'server', 'server', 'server', 'server', 'server', 'server']"
HBASE-23173,ArrayIndexOutOfBoundsException in BaseLoadBalancer$Cluster.removeRegion,"['node', 'region']"
HBASE-24211,Create table is slow in large cluster when AccessController is enabled.,"['node', 'node', 'node', 'node', 'node', 'node', 'node', 'node', 'node', 'delay', 'delay', 'delay', 'cluster', 'cluster', 'assign', 'assign', 'assign', 'assign', 'block', 'region', 'region', 'region', 'region', 'region', 'assign', 'assign', 'assign', 'assign', 'server']"
HBASE-22806,Deleted CF are not cleared if memstore contain entries,"['region', 'region']"
HBASE-25698,Persistent IllegalReferenceCountException at scanner open when using TinyLfuBlockCache,"['cluster', 'cluster', 'cluster', 'replica', 'block', 'meta', 'region', 'region', 'region', 'region', 'region', 'region', 'region', 'region', 'region', 'server', 'server', 'server', 'server', 'server', 'server', 'server', 'server', 'server']"
HBASE-25472,HBASE-24260 breaks JDK7 compilation in branch-1,"['server', 'server', 'server', 'server', 'server']"
HBASE-22652,Flakey TestLockManager; test timed out after 780 seconds,"['region', 'race', 'race', 'server']"
HBASE-26643,LoadBalancer should not return empty map,"['assign', 'assign', 'assign', 'assign', 'server']"
HBASE-26062,SIGSEGV in AsyncFSWAL consume,"['cluster', 'replica', 'replica', 'replica', 'meta', 'region', 'region', 'region', 'region', 'region', 'region', 'region', 'region', 'region', 'server', 'server', 'server', 'server', 'server', 'server', 'server', 'server', 'server']"
HBASE-23709,Unwrap the real user to properly dispatch proxy-user auth'n,['consistent']
HBASE-24896,'Stuck' in static initialization creating RegionInfo instance,"['replica', 'meta', 'region', 'region', 'region', 'region', 'region', 'region', 'region', 'region', 'region', 'region', 'region', 'region', 'region', 'region', 'region', 'region', 'server', 'server', 'server', 'server', 'server', 'server', 'server', 'server', 'server', 'server', 'server', 'server', 'server', 'server', 'server', 'server', 'server']"
HBASE-24601,Change default Hfile storage policy from HOT to NONE for HDFS,"['block', 'meta']"
HBASE-24517,AssignmentManager.start should add meta region to ServerStateNode,"['assign', 'meta', 'meta', 'meta', 'meta', 'meta', 'region', 'region', 'region', 'region', 'region', 'region', 'region', 'region', 'region', 'assign', 'server', 'server']"
HBASE-26812,ShortCircuitingClusterConnection fails to close RegionScanners when making short-circuited calls,['region']
HBASE-22965,RS Crash due to DBE reference to an reused ByteBuff,"['block', 'crash', 'crash']"
HBASE-26967,FilterList with FuzzyRowFilter and SingleColumnValueFilter evaluated with operator MUST_PASS_ONE doesn't work as expected,"['connection', 'connection']"
HBASE-26199,hbck2 should support remove deleted meta region,"['meta', 'meta', 'region', 'region', 'region', 'region', 'restart']"
HBASE-24372,Assign table to default RSGroup may throw exception when RSGroup enabled,"['assign', 'assign', 'region', 'assign', 'assign', 'server', 'server']"
HBASE-26036,DBB released too early and dirty data for some operations,"['cluster', 'crash', 'region', 'region', 'region', 'region', 'region', 'server', 'server', 'server', 'server', 'server']"
HBASE-23045, currentPath may be stitched in a loop in replication source code.,['replica']
HBASE-23782,We still reference the hard coded meta descriptor in some places when listing table descriptors,['meta']
HBASE-22751,table.jsp fails if ugly regions in table,"['meta', 'meta', 'region', 'region', 'region', 'server', 'server', 'server']"
HBASE-22442,Nightly build is failing with hadoop 3.x,"['server', 'server', 'server', 'server', 'server', 'server', 'server', 'server', 'server', 'server', 'server', 'server', 'server', 'server', 'server', 'server', 'server', 'server', 'server', 'server', 'server', 'server', 'server', 'server', 'server', 'server', 'server', 'server', 'server', 'server', 'server', 'server', 'server', 'server', 'server', 'server', 'server', 'server', 'server', 'server', 'server', 'server', 'server', 'server', 'server', 'server', 'server', 'server', 'server', 'server', 'server', 'server', 'server', 'server', 'server', 'server', 'server', 'server', 'server', 'server', 'server', 'server', 'server', 'server', 'server']"
HBASE-22867,The ForkJoinPool in CleanerChore will spawn thousands of threads in our cluster with thousands table,"['cluster', 'block', 'block', 'block', 'connection', 'server']"
HBASE-25088,CatalogFamilyFormat/MetaTableAccessor.parseRegionInfoFromRegionName incorrectly setEndKey to regionId,"['region', 'region']"
HBASE-22686,ZkSplitLogWorkerCoordination doesn't allow a regionserver to pick up all of the split work it is capable of,"['node', 'node', 'cluster', 'cluster', 'cluster', 'assign', 'assign', 'crash', 'crash', 'crash', 'crash', 'distributed', 'distributed', 'region', 'region', 'region', 'region', 'region', 'region', 'region', 'region', 'region', 'region', 'region', 'region', 'region', 'region', 'region', 'region', 'region', 'assign', 'assign', 'server', 'server', 'server', 'server', 'server', 'server', 'server', 'server', 'server', 'server', 'server', 'server', 'server', 'restart']"
HBASE-26274,Create an option to reintroduce BlockCache to mapreduce job,"['block', 'block', 'region', 'region', 'server']"
HBASE-25741,Deadlock during peer cleanup with NoNodeException,"['replica', 'replica', 'replica', 'replica', 'replica', 'region', 'region', 'region', 'region', 'server', 'server', 'server', 'server', 'server', 'server', 'server']"
HBASE-24552,Replica region needs to check if primary region directory exists at file system  in TransitRegionStateProcedure ,"['replica', 'replica', 'replica', 'replica', 'region', 'region', 'region', 'region', 'region', 'region', 'region', 'region', 'region', 'region', 'region', 'region', 'region', 'region', 'server', 'server']"
HBASE-24031,TestHRegion.testCheckAndMutate_WithFilters is flaky,"['region', 'region', 'region', 'server', 'server', 'server']"
HBASE-26722,"Snapshot is corrupted due to interaction between move, warmupRegion, compaction, and HFileArchiver","['assign', 'corrupt', 'region', 'region', 'region', 'region', 'region', 'region', 'region', 'region', 'region', 'race', 'assign', 'server']"
HBASE-23157,WAL unflushed seqId tracking may wrong when Durability.ASYNC_WAL is used,"['region', 'region']"
HBASE-23684,NPE HFilesOutputSink,"['corrupt', 'region', 'region', 'region', 'region', 'region', 'region', 'server', 'server', 'server', 'server']"
HBASE-26687,Account for HBASE-24500 in regionInfoMismatch tool,"['region', 'region']"
HBASE-22632,SplitTableRegionProcedure and MergeTableRegionsProcedure should skip store files for unknown column families,"['cluster', 'region']"
HBASE-27053,IOException during caching of uncompressed block to the block cache.,"['cluster', 'cluster', 'block', 'block', 'block', 'block', 'block', 'block', 'block', 'region', 'region', 'region', 'region', 'region', 'region', 'region', 'region', 'region', 'region', 'region', 'region', 'region', 'region', 'region', 'region', 'region', 'region', 'region', 'region', 'region', 'region', 'region', 'region', 'region', 'region', 'server', 'server', 'server', 'server', 'server', 'server', 'server', 'server', 'server', 'server', 'server', 'server', 'server', 'server', 'server', 'server', 'server', 'server', 'server', 'server', 'server', 'server', 'server', 'server']"
HBASE-22774,[WAL] RegionGroupingStrategy loses its function after split,"['region', 'region', 'region', 'region', 'region', 'server', 'restart']"
HBASE-23117,Bad enum in hbase:meta info:state column can fail loadMeta and stop startup,"['cluster', 'cluster', 'assign', 'assign', 'assign', 'assign', 'assign', 'assign', 'assign', 'meta', 'meta', 'meta', 'assign', 'assign', 'assign', 'assign', 'assign', 'assign', 'assign']"
HBASE-23051,Remove unneeded Mockito.mock invocations,"['assign', 'assign', 'server', 'server', 'server']"
HBASE-26815,TestFanOutOneBlockAsyncDFSOutput is flakey,"['node', 'node', 'node', 'restart']"
HBASE-26998,TestRegionProcessRowsWithLocks#testProcessExceptionAndRollBack is broken in branch-1,"['region', 'region', 'region', 'region', 'server', 'server', 'server', 'server', 'server']"
HBASE-25371,"When openRegion fails during initial verification(before initializing and setting seq num), exception is observed during region close.","['region', 'region', 'region', 'region', 'region', 'region', 'region', 'region', 'region', 'region', 'region', 'region', 'region', 'region', 'region', 'region', 'region', 'server', 'server', 'server', 'server', 'server', 'server', 'server', 'server', 'server', 'server', 'server', 'server', 'server']"
HBASE-26864,SplitTableRegionProcedure calls openParentRegions() at a wrong state during rollback.,"['assign', 'assign', 'assign', 'assign', 'assign', 'region', 'region', 'region', 'assign', 'assign', 'assign', 'assign', 'assign', 'server', 'server']"
HBASE-26429,HeapMemoryManager fails memstore flushes with NPE if enabled,"['block', 'block', 'region', 'region', 'region', 'region', 'region', 'region', 'region', 'region', 'region', 'region', 'server', 'server', 'server', 'server', 'server', 'server', 'server', 'server', 'server']"
HBASE-23737,[Flakey Tests] TestFavoredNodeTableImport fails 30% of the time,"['node', 'node', 'cluster', 'region']"
HBASE-26074,testLogLevelByHttps/testLogLevelByHttpsWithSpnego consistently failing on branch-1,"['consistent', 'consistent', 'race', 'server', 'server', 'server', 'server']"
HBASE-26437,[hboss] Rename does not clean up znodes for src location,"['node', 'node', 'node', 'node', 'node', 'cluster', 'partition']"
HBASE-22274,Cell size limit check on append should consider cell's previous size.,"['server', 'server', 'server', 'server', 'server']"
HBASE-22003,Fix flaky test TestVerifyReplication.testHBase14905,"['replica', 'replica', 'replica']"
HBASE-25590,Bulkload replication HFileRefs cannot be cleared in some cases where set exclude-namespace/exclude-table-cfs,"['cluster', 'replica', 'replica', 'replica', 'replica', 'remote', 'region', 'server', 'server']"
HBASE-22661,list_regions command in hbase shell is broken,"['cluster', 'region', 'region', 'region']"
HBASE-24480,Deflake TestRSGroupsBasics#testClearDeadServers,"['server', 'server', 'server']"
HBASE-22224,hbase-connectors precommit fails if no tests are executed,['server']
HBASE-23359,RS going down with NPE when splitting a region with compaction disabled in branch-1,"['region', 'region', 'region', 'region', 'region', 'region', 'region', 'region', 'region', 'region', 'region', 'region', 'region', 'region', 'region', 'region', 'region', 'server', 'server', 'server', 'server', 'server', 'server', 'server', 'server', 'server', 'server', 'server', 'server', 'server', 'server', 'server']"
HBASE-23590,Update maxStoreFileRefCount to maxCompactedStoreFileRefCount,"['region', 'region']"
HBASE-26299,Fix TestHTableTracing.testTableClose for nightly build of branch-2,"['connection', 'race', 'race', 'race', 'race', 'race', 'race', 'race', 'race', 'race', 'race', 'race', 'race', 'race', 'race', 'race', 'race', 'race', 'race', 'race', 'race', 'race', 'race', 'race']"
HBASE-22793,RPC server connection is logging user as NULL principal,"['remote', 'remote', 'remote', 'connection', 'race', 'race', 'server']"
HBASE-26001,"When turn on access control, the cell level TTL of Increment and Append operations is invalid.","['race', 'race', 'race', 'race']"
HBASE-23040,region mover gives NullPointerException instead of saying a host isn't in the cluster,"['cluster', 'cluster', 'cluster', 'region', 'region', 'server']"
HBASE-22404,Open/Close region request may be executed twice when master restart,"['remote', 'remote', 'region', 'region', 'region', 'region', 'region', 'region', 'region', 'region', 'region', 'region', 'region', 'restart']"
HBASE-25905,Shutdown of WAL stuck at waitForSafePoint,"['cluster', 'region', 'region', 'region', 'region', 'region', 'region', 'region', 'region', 'region', 'server', 'server', 'server', 'server', 'server', 'server', 'server', 'server', 'server']"
HBASE-22509,Address findbugs/spotbugs complaints (branch-1.4) ,"['consistent', 'region', 'region', 'server', 'server', 'server']"
HBASE-25457,Possible race in AsyncConnectionImpl between getChoreService and close,['race']
HBASE-26679,Wait on the future returned by FanOutOneBlockAsyncDFSOutput.flush would stuck,['node']
HBASE-24931,Candidate Generator helper getAction method ignoring 0th index region,['region']
HBASE-23197,"""IllegalArgumentException: Wrong FS"" on edits replay when WALs on different file system and hbase.region.archive.recovered.edits is enabled. ","['meta', 'meta', 'region', 'region', 'region', 'region', 'region', 'region', 'region', 'region', 'region', 'race', 'server', 'server', 'server', 'server', 'server', 'server']"
HBASE-23247,[hbck2] Schedule SCPs for 'Unknown Servers',"['cluster', 'cluster', 'cluster', 'assign', 'assign', 'assign', 'assign', 'assign', 'assign', 'assign', 'assign', 'assign', 'assign', 'crash', 'meta', 'meta', 'meta', 'meta', 'meta', 'meta', 'meta', 'meta', 'meta', 'meta', 'meta', 'region', 'region', 'region', 'assign', 'assign', 'assign', 'assign', 'assign', 'assign', 'assign', 'assign', 'assign', 'assign', 'server', 'server', 'server', 'server', 'server', 'server', 'server', 'server', 'server', 'server', 'server', 'server', 'server', 'server', 'server', 'server', 'server', 'server', 'server']"
HBASE-22801,Maven build issue on Github PRs,"['meta', 'meta', 'meta', 'meta', 'meta']"
HBASE-24479,Deflake TestCompaction#testStopStartCompaction,"['region', 'race', 'server']"
HBASE-23660,hbase:meta's table.jsp ref to wrong rs address   ,['meta']
HBASE-25307,ThreadLocal pooling leads to NullPointerException,['race']
HBASE-22067,Fix log line in StochasticLoadBalancer when balancer is an ill-fit for cluster size,['cluster']
HBASE-26946,TestRetainAssignmentOnRestartSplitWithoutZk infinite loop,"['region', 'region', 'region', 'region', 'server', 'server', 'server', 'server', 'server', 'restart']"
HBASE-25238,Upgrading HBase from 2.2.0 to 2.3.x fails because of “Message missing required fields: state”,"['node', 'node', 'node', 'node', 'cluster', 'cluster', 'cluster', 'assign', 'assign', 'assign', 'assign', 'connection', 'region', 'region', 'region', 'region', 'region', 'region', 'region', 'region', 'region', 'region', 'region', 'region', 'region', 'region', 'region', 'region', 'region', 'region', 'region', 'region', 'region', 'race', 'assign', 'assign', 'assign', 'assign', 'server', 'server', 'server', 'server', 'server', 'server', 'server', 'server', 'server', 'server', 'server', 'server', 'server', 'server']"
HBASE-24284,[h3/jdk11] REST server won't start,"['server', 'server', 'server']"
HBASE-23804,Fix default master addr hostname in master registry,"['distributed', 'server', 'server', 'server', 'server', 'server']"
HBASE-22896,TestHRegion.testFlushMarkersWALFail is flaky,"['region', 'region', 'region', 'region', 'region', 'region', 'region', 'region', 'region', 'region', 'region', 'region', 'region', 'region', 'region', 'region', 'region', 'region', 'region', 'region', 'region', 'region', 'region', 'region', 'region', 'region', 'region', 'region', 'region', 'region', 'region', 'server', 'server', 'server', 'server', 'server', 'server', 'server', 'server', 'server', 'server', 'server', 'server', 'server', 'server', 'server', 'server', 'server', 'server', 'server', 'server', 'server', 'server', 'server', 'server', 'server', 'server', 'server', 'server', 'server', 'server', 'server', 'server']"
HBASE-26467,Wrong Cell Generated by MemStoreLABImpl.forceCopyOfBigCellInto when Cell size bigger than data chunk size ,"['cluster', 'region', 'region', 'region', 'region', 'region', 'region', 'region', 'region', 'region', 'region', 'region', 'region', 'region', 'region', 'region', 'region', 'region', 'server', 'server', 'server', 'server', 'server', 'server', 'server', 'server', 'server', 'server', 'server', 'server', 'server', 'server', 'server']"
HBASE-22414,Interruption of moving regions in RSGroup will cause regions on wrong rs,"['assign', 'region', 'region', 'region', 'region', 'region', 'region', 'assign', 'server']"
HBASE-26763,Setback occurs to AsyncFSWAL#highestProcessedAppendTxid and then IllegalArgumentException,"['crash', 'region', 'region', 'region', 'region', 'region', 'region', 'region', 'region', 'race', 'server', 'server', 'server', 'server', 'server', 'server', 'server', 'server']"
HBASE-22121,AsyncAdmin can not deal with non default meta replica,"['replica', 'replica', 'replica', 'meta', 'meta', 'meta', 'meta', 'region', 'region', 'region', 'region']"
HBASE-23263,NPE in Quotas.jsp,"['region', 'server']"
HBASE-27106,HBase site generation should use its own JRuby,['consistent']
HBASE-23376,NPE happens while replica region is moving,"['replica', 'replica', 'replica', 'region', 'region', 'region', 'region', 'race']"
HBASE-22923,hbase:meta is assigned to localhost when we downgrade the hbase version,"['assign', 'assign', 'assign', 'assign', 'assign', 'assign', 'meta', 'meta', 'meta', 'meta', 'meta', 'assign', 'assign', 'assign', 'assign', 'assign', 'assign', 'server', 'server', 'server', 'server', 'server']"
HBASE-22529,Sanity check for in-memory compaction policy,"['region', 'region', 'region', 'region', 'region', 'region', 'region', 'region', 'region', 'region', 'region', 'region', 'region', 'region', 'region', 'region', 'region', 'server', 'server', 'server', 'server', 'server', 'server', 'server', 'server', 'server', 'server', 'server', 'server', 'server', 'server', 'server']"
HBASE-26777,BufferedDataBlockEncoder$OffheapDecodedExtendedCell.deepClone throws UnsupportedOperationException,"['region', 'server']"
HBASE-24234,ChecksumUtil class validateChecksum method log level does not match,"['race', 'race']"
HBASE-26761,TestMobStoreScanner (testGetMassive) can OOME,['race']
HBASE-22490,Nightly client integration test fails with hadoop-3,"['node', 'node', 'node', 'node', 'node', 'node', 'node', 'node', 'node', 'node', 'consistent', 'consistent', 'server', 'server', 'server', 'server', 'server', 'server', 'server', 'server', 'server', 'server']"
HBASE-24027,Spotbugs: Return value of putIfAbsent is ignored,"['node', 'node', 'assign', 'assign', 'assign', 'assign', 'assign', 'assign', 'assign', 'assign', 'server']"
HBASE-22684,The log rolling request maybe canceled immediately in LogRoller due to a race,['race']
HBASE-22503,Failed to upgrade to 2.2+ as the global permission which storaged in zk is not right ,"['region', 'region']"
HBASE-26741,Incorrect exception handling in shell,['race']
HBASE-23262,Cannot load Master UI,"['replica', 'region', 'region', 'region', 'server', 'server']"
HBASE-25598,TestFromClientSide5.testScanMetrics is flaky,['server']
HBASE-22939,SpaceQuotas- Bulkload from different hdfs failed when space quotas are turned on.,"['region', 'server']"
HBASE-22378,HBase Canary fails with TableNotFoundException when table deleted during Canary run,['race']
HBASE-26383,HBCK incorrectly reports inconsistencies for recently split regions following a master failover,"['consistent', 'region', 'region', 'region', 'region', 'region', 'region', 'region', 'region', 'region', 'restart']"
HBASE-22230,REST Server drops connection on long scans,"['connection', 'connection', 'connection', 'connection']"
HBASE-26468,Region Server doesn't exit cleanly incase it crashes.,"['cluster', 'cluster', 'crash', 'crash', 'region', 'region', 'server', 'server', 'server', 'server', 'server', 'restart']"
HBASE-23006,RSGroupBasedLoadBalancer should also try to place replicas for the same region to different region servers,"['replica', 'replica', 'region', 'region', 'region', 'server']"
HBASE-23601,OutputSink.WriterThread exception gets stuck and repeated indefinietly,"['replica', 'replica', 'replica', 'restart']"
HBASE-25994,Active WAL tailing fails when WAL value compression is enabled,['replica']
HBASE-25178,Remove the hadoop 3.3.0 personality hadoopcheck for branch-2.2/branch-2.3,['node']
HBASE-23054,Remove synchronization block from MetaTableMetrics and fix LossyCounting algorithm,"['block', 'block']"
HBASE-25498,[Documentation] Add a comment when using Secure HTTP (HTTPS) for the Web UI,"['connection', 'connection', 'region', 'region', 'region', 'server', 'server', 'server', 'server']"
HBASE-26960,Another case for unnecessary replication suspending in RegionReplicationSink,"['replica', 'replica', 'replica', 'replica', 'replica', 'replica', 'replica', 'replica', 'region']"
HBASE-23670,fix flaky TestSplitTransactionOnCluster,['block']
HBASE-27170,ByteBuffAllocator leak when decompressing blocks near minSizeForReservoirUse,"['cluster', 'cluster', 'block', 'block', 'block', 'block', 'block', 'block', 'block', 'region', 'region', 'region', 'region', 'region', 'region', 'region', 'region', 'region', 'region', 'region', 'region', 'region', 'region', 'region', 'region', 'region', 'region', 'region', 'region', 'region', 'region', 'region', 'region', 'region', 'region', 'region', 'region', 'region', 'region', 'region', 'region', 'region', 'region', 'race', 'race', 'race', 'race', 'race', 'race', 'race', 'race', 'race', 'server', 'server', 'server', 'server', 'server', 'server', 'server', 'server', 'server', 'server', 'server', 'server', 'server', 'server', 'server', 'server', 'server', 'server', 'server', 'server', 'server', 'server', 'server', 'server', 'server', 'server', 'server', 'server', 'server', 'server', 'server', 'restart']"
